Name,Vanity,Profile URL,Note,Status,Added,Last Checked,Times Checked,Avg Score
Harrison Chase,harrison-chase-961287118,https://www.linkedin.com/in/harrison-chase-961287118,LangChain/LangGraph founder driving agent infrastructure,active,2026-06-12,2026-06-12 19:07,1,5.5
Yohei Nakajima,yoheinakajima,https://www.linkedin.com/in/yoheinakajima,Creator of BabyAGI and experimental agent architectures,active,2026-06-12,2026-06-12 19:07,1,4.5
Andrew Ng,andrewyng,https://www.linkedin.com/in/andrewyng,DeepLearning.AI founder and major advocate for agentic design patterns,active,2026-06-12,2026-06-12 19:07,1,6.0
Denny Zhou,denny-zhou-7695487,https://www.linkedin.com/in/denny-zhou-7695487,Google DeepMind Reasoning Team lead pioneering LLM logic frameworks,active,2026-06-12,2026-06-12 19:07,1,
Andrej Karpathy,andrej-karpathy-9a650716,https://www.linkedin.com/in/andrej-karpathy-9a650716,,active,2026-06-12,2026-06-12 19:07,1,
